{
  "contractVersion": "1.0.0",
  "kind": "lookup-outcomes",
  "registry": [
    {
      "encryptionAddress": "032ebaf076203f15ac8119cfdbc9394d1c7b9929b0647e4f607e27da95701f8556",
      "id": "R-001",
      "profileAlias": "public-test-alias-001",
      "signingAddress": "0237fdd4364c0b898908be2f1a98a6b4a7890c623ae92a283640e44d87e048daa5"
    },
    {
      "encryptionAddress": "0400e26b2c6e77ce44f40f56eadd6add5a134d4f6f09d43ba38faadbf2f9a6b781d07e19ea77fdd21ba5c31c3975d2f7107c9e3be247401a7b0e5853fea09b3a10",
      "id": "R-002",
      "profileAlias": "public-test-alias-002",
      "signingAddress": "042b347a16473bab675d469b6094deb96cd21239b855b98f98a4f8194953988306f9a5c50de7d68eb543364cbca033c05201a7cc93e96b61a8fb95402bc6e3b66e"
    },
    {
      "encryptionAddress": "03b6a82bd9967a8299b5ce995c308c2ffddd3b56abd302485257764818e31eccd3",
      "id": "R-003",
      "profileAlias": "public-test-alias-003",
      "signingAddress": "02428641d21f53e5a631373c4ce763674a6fa178703a99858ab748731d6f488a97"
    }
  ],
  "scenarios": [
    {
      "candidates": [
        {
          "encryptionAddress": "04adaac2d1272bf0a3c7c7e2dcd2efe052a78311d32ad417dc3ada47ebda8fa29a236e8762c3b8355ff00dd46f8f5530afabace14af9b75aee9f7518045864e3cf",
          "producerId": "P-02",
          "signingAddress": "04423e037fa9a32a94b8f36316c706c9470903ea9e6cd9baa961b48cb272eef5a836c7fe86525a2fd79bfe2e044c5c4cca4321cefb69df996057248f5bc283df03"
        }
      ],
      "expected": {
        "ambiguous": false,
        "matchCount": 0
      },
      "id": "L-001",
      "label": "zero matches",
      "notes": "No controlled identity registered for this candidate pair."
    },
    {
      "candidates": [
        {
          "encryptionAddress": "032ebaf076203f15ac8119cfdbc9394d1c7b9929b0647e4f607e27da95701f8556",
          "producerId": "P-01",
          "signingAddress": "0237fdd4364c0b898908be2f1a98a6b4a7890c623ae92a283640e44d87e048daa5"
        }
      ],
      "expected": {
        "ambiguous": false,
        "matchCount": 1,
        "registryIds": [
          "R-001"
        ]
      },
      "id": "L-002",
      "label": "one match",
      "notes": "Single exact address-pair match resolves to one controlled identity."
    },
    {
      "candidates": [
        {
          "encryptionAddress": "032ebaf076203f15ac8119cfdbc9394d1c7b9929b0647e4f607e27da95701f8556",
          "producerId": "P-01",
          "signingAddress": "0237fdd4364c0b898908be2f1a98a6b4a7890c623ae92a283640e44d87e048daa5"
        },
        {
          "encryptionAddress": "0400e26b2c6e77ce44f40f56eadd6add5a134d4f6f09d43ba38faadbf2f9a6b781d07e19ea77fdd21ba5c31c3975d2f7107c9e3be247401a7b0e5853fea09b3a10",
          "producerId": "P-02",
          "signingAddress": "042b347a16473bab675d469b6094deb96cd21239b855b98f98a4f8194953988306f9a5c50de7d68eb543364cbca033c05201a7cc93e96b61a8fb95402bc6e3b66e"
        }
      ],
      "expected": {
        "ambiguous": true,
        "matchCount": 2,
        "registryIds": [
          "R-001",
          "R-002"
        ]
      },
      "id": "L-003",
      "label": "multiple matches (same mnemonic, both approved producers)",
      "notes": "The same mnemonic derives two registered identities under P-01 and P-02 contracts; the API must return an explicit ambiguous result and never silently choose."
    },
    {
      "candidates": [
        {
          "encryptionAddress": "0400e26b2c6e77ce44f40f56eadd6add5a134d4f6f09d43ba38faadbf2f9a6b781d07e19ea77fdd21ba5c31c3975d2f7107c9e3be247401a7b0e5853fea09b3a10",
          "producerId": "P-02",
          "signingAddress": "042b347a16473bab675d469b6094deb96cd21239b855b98f98a4f8194953988306f9a5c50de7d68eb543364cbca033c05201a7cc93e96b61a8fb95402bc6e3b66e"
        },
        {
          "encryptionAddress": "0400e26b2c6e77ce44f40f56eadd6add5a134d4f6f09d43ba38faadbf2f9a6b781d07e19ea77fdd21ba5c31c3975d2f7107c9e3be247401a7b0e5853fea09b3a10",
          "producerId": "P-03",
          "signingAddress": "042b347a16473bab675d469b6094deb96cd21239b855b98f98a4f8194953988306f9a5c50de7d68eb543364cbca033c05201a7cc93e96b61a8fb95402bc6e3b66e"
        }
      ],
      "expected": {
        "ambiguous": false,
        "deduplicated": true,
        "matchCount": 1,
        "producers": [
          "P-02",
          "P-03"
        ],
        "registryIds": [
          "R-002"
        ]
      },
      "id": "L-004",
      "label": "exact-pair deduplication",
      "notes": "Candidates with identical exact encoded address pairs deduplicate while retaining all contributing producer IDs."
    },
    {
      "candidates": [
        {
          "encryptionAddress": "032ebaf076203f15ac8119cfdbc9394d1c7b9929b0647e4f607e27da95701f8556",
          "producerId": "P-01",
          "signingAddress": "0237fdd4364c0b898908be2f1a98a6b4a7890c623ae92a283640e44d87e048daa5"
        },
        {
          "encryptionAddress": "042ebaf076203f15ac8119cfdbc9394d1c7b9929b0647e4f607e27da95701f8556c504b47716429267f692b808934bfa3838eae8f4f23c25f29fb848190adafcf9",
          "producerId": "P-01",
          "signingAddress": "0437fdd4364c0b898908be2f1a98a6b4a7890c623ae92a283640e44d87e048daa538a4404b9bfccf61c2cf633964a1ce7619534c26f552dd21ee1880a49cb140a0"
        }
      ],
      "expected": {
        "ambiguous": false,
        "matchCount": 1,
        "registryIds": [
          "R-001"
        ]
      },
      "id": "L-005",
      "label": "compressed vs uncompressed are distinct candidates",
      "notes": "Profiles are keyed by exact address strings; only the compressed pair is registered, so the uncompressed encoding is a distinct non-matching candidate."
    }
  ],
  "schemaVersion": "1.0.0"
}
